,Published Date,Story Name,Story,Author
412,2019-06-04T19:00:08+0000,Our New Junior Suite,"At 30, my husband applied to law school. This financial reality meant we would need to leave our beloved Manhattan apartment and move in with my parents in New Jersey. I dreaded the conversation. Just three months into retirement, my parents had finally begun to enjoy their empty nest. I was sweating when I called and had barely begun to explain our new circumstances when my mother said, “Of course you’ll stay with us.” Later, my father sent an email with a floor plan. Two rooms on the second floor were highlighted as “The New Junior Suite.” — TJ Maresca",TJ Maresca
413,2019-06-04T19:00:08+0000,"Noise, Then Silence","My husband and I watched from the driveway as our son and his family of five packed their van for the seven-hour drive home. For a week, our house had thrilled to the sounds of small feet on stairs, stories being read, spoons clinking against cereal bowls. Now my littlest grandchild’s tricycle was put into the van’s hatch, the door slammed, the engine started. We leaned in for last hugs. As their car backed away, the sense of loss was sudden and sharp. For days we had been absorbed into the life of this precious family. And now, not. — Penelope Lemov",Penelope Lemov
414,2019-06-04T19:00:08+0000,Letting Go of Signs,"Our marriage days old, signs portended disaster. My ring didn’t fit. When the jeweler stretched it, it shattered. On our honeymoon, a hurricane struck Cancún. Diverted to Nassau, we fled our hotel because of a fire; the concierge booked us a new room with ceiling plaster littering the bed. While snorkeling, Jim’s wedding band disappeared. He quit searching at dusk. I continued, for years, along other shorelines. Last summer, I lazily stopped wearing my ring. In Scotland for our October anniversary, Jim noticed and felt hurt. But I have let go of signs, symbols. Thirty years is proof enough. — Linda Lowen",Linda Lowen
415,2019-05-28T19:00:02+0000,An Elephant Named Donna,"When I was 3 months old, my father bought me an elephant named Donna. We kept her in our two-acre yard in Orange, Conn. My only “memories” of Donna are from other peoples’ stories: the enormous piles of dung my brothers had to shovel, the time she ate my mother’s rose bushes, her “bedroom” fashioned out of a converted garage. My father was a diesel truck mechanic and my mother a homemaker. We weren’t rich, just working-class people. “Love makes you do crazy things,” my father liked to say. — Judith Nacca",Judith Nacca
416,2019-05-28T19:00:02+0000,"What Love Was, the First Time","I was 16 with Pakistani parents as traditional as they come. His family was proudly American, too proud for a brown girl like me. Neither house held open doors so we scrambled into my parent’s Pontiac. Each kiss was resistance. Legs cramped as the hours passed, but cup holders held sustenance in the form of strawberry milkshakes. That first love was finding obscure parking lots and fogging up windows. It was discovering clothes in the back seat and smirking as I was driven to church on a Sunday. — Sharmeen Chauhdry",
417,2019-05-28T19:00:02+0000,Pierce My Ears or Run Away?,"The kitchen whiteboard was erased, replaced by our 7-year-old’s survey: “Isabel is going to get her ears perest or run away. Wich one do you choose?” “P. S. Once you choose you have to let her do it!!” Then a chart, with choices: “ears perst” or “runaway.” “Put a ✔ in the spase you want.” To her older brother: “Jeff you have to do it as if you incredibly cared for me.” Lastly: “P.S. I don’t care if I spell thing rong.” Proud of Isabel’s defiance and ingenuity, my wife and I eventually let her get her ears “perst.” — Robert Schroeder",Robert Schroeder
418,2019-05-28T19:00:02+0000,Caught in a Maze,"There were signs she liked me. An invitation here, a late-night text there. The excitement, smiles and sincerity — all of which I was too clueless to notice. Then came a deliciously warm night, fueled by cheap drinks and music in a dimly lit Shanghai karaoke establishment. A missing cellphone, a search through a maze of hallways, a slowed pace, an interlocking of arms, a quiet “Can I kiss you?” As my oblivious mind tried to come to its senses, I blurted: “Sorry, but are you gay?” A few years later, I can proudly confirm that we both are. — Elizabeth Forman",Elizabeth Forman
419,2019-05-28T19:00:02+0000,“Hey” Is Not “Heyy”,"“Heyy,” his message read. My heart fluttered. One “y” may have left me upset, but the second “y” — that was promising. Such a simple yet ambiguous greeting. Did he want to hang out? Was he going to confess his love? Oh! He was typing. A double text! It was my lucky day. I broke a sweat waiting for his response. How should I respond? “Hi!”? “I am in love with you”? My message had to show the same amount of interest as his. He responded! “Sorry didn’t mean the extra ‘y.’” Oh. — Julia DiGeronimo",Julia DiGeronimo
420,2019-05-21T19:00:02+0000,Inseparable Twins,"Sick of being “the twins,” we made rules for freshman year. Keep my hair short and red, Anushka’s brown and long. Live in different dorms. Sit on opposite sides of lectures (nature and nurture against us, we’re both biology majors). No eating in the same dining hall or going to the same parties. Meet once a week, max. That didn’t last. I couldn’t live apart from someone who’s a part of me. After a year of enduring impossible problem sets, roommate drama, assorted heartbreaks and our parents’ divorce, we laugh at how we once thought we’d do it alone. — Anjali Walia, Yale University","Anjali Walia, Yale University"
421,2019-05-21T19:00:02+0000,A Frozen Moment,"I flew to Idaho over winter break to see Sumner’s hometown. Our first night, we went skating on a frozen pond, surrounded by snow. I was nervous. I didn’t play sports growing up, and I hadn’t ice skated since I was a child. He circled the pond, not showing off, simply enjoying the movement. I’ll never forget the stars piercing the darkness and the shadowy outline of the towering mountains. Fifteen minutes later, I realized I had forgotten that I was supposed to learn how to skate; I had just been watching him the whole time. — Zipi Diamond, St. Olaf College","Zipi Diamond, St. Olaf College"
422,2019-05-21T19:00:02+0000,Waiting for the Buffering to End,"My boyfriend and I try to have a date night every weekend. Typical, except our dates span two time zones and 1,800 miles. I attend college in Ohio, and he in Arizona. Love, for us, has become FaceTiming during meals (so we don’t have to eat alone), packing his favorite baked goods ever-so-tightly so they don’t go stale in the mail, and pausing the Netflix movie because the other person’s laptop is buffering. We sprint through the airport one way and trudge the other. It’s not an easy relationship, but it’s ours. — Gina Deaton, Xavier University","Gina Deaton, Xavier University"
423,2019-05-21T19:00:02+0000,“Am I Safe?”,"Tears welled as I realized the contrast between us and the couple a few feet over, watching the same flamenco show. They were in their mid-20s with vibrant chemistry, his arm around hers, feeding each other from their shared plate. Patrick and I sat across from each other, our physical contact limited to footsie hidden under the table. My anguish turned to rage that we live in a world where I cannot love as uncompromisingly as a straight person, in which every display of affection comes with the thought, “Am I safe?” — Christian Correa, University of North Carolina Chapel Hill","Christian Correa, University of North Carolina Chapel Hill"
424,2019-05-21T19:00:02+0000,An Edible Bouquet,"It was Valentine’s Day, and I was his first girlfriend. He nervously asked me if I wanted flowers. I jokingly said I’d rather have bacon. When I returned from class, he came bearing a bacon-and-chicken-nugget bouquet. — Michelle Huang, New York University","Michelle Huang, New York University"
425,2019-05-21T19:00:02+0000,Fumbling With Love,"Freshman year, our rooms feet apart. Arturo and I barely saw the sun that winter, only each other. As snow piled up, we bonded over our immigrant backgrounds with microwave popcorn under string lights. He kissed me even though I had mono (but never got sick). We were virgins to love, fumbling with its magnificence like we fumbled with belt buckles and bra straps. Then we broke up, still living only feet apart, followed by a summer of pining playlists and blocked calls. Next year, across campus, a shared strawberry crepe. Somehow, by growing apart, we had grown back together. — Magdalena Mihaylova, University of Michigan","Magdalena Mihaylova, University of Michigan"
426,2019-05-21T19:00:02+0000,A Scarier Kind of Gravity,"How to meet cute: 1. Exploit Tinder to deal with your fidgety fingers. 2. Make plans to meet in Central Park, but don’t send your location (“Let’s play hide and seek — black dress”). 3. Withhold your outrage when he gives up and says to look for him instead. 4. Spin in frustrated circles until you spot him on top of a rock. 5. Instantly overcome your fear of heights to climb to him. 6. Over the next three hours, succumb to a much different, much scarier kind of gravity. 7. Delete Tinder. — Linh Nguyen, Princeton University","Linh Nguyen, Princeton University"
427,2019-05-14T19:00:01+0000,Broadcasting the Truth,"The things I was too scared to say to him in person, I would talk about on my podcast. I knew he’d be listening. My medication? Yes. Sexual history? Sure. Fears? I’d pepper these throughout the episodes. “It’s funny,” he’d say. “I’m learning so much about you. All I have to do is listen to your podcast.” With my lips to the microphone and his earphones at the ready, I thought I was saving us from having to discuss the awkward topics face-to-face, but without that vulnerability, we never stood a chance. Like every episode, the end was inevitable. — Louis Hanson, University of Sydney, Australia","Louis Hanson, University of Sydney, Australia"
428,2019-05-14T19:00:01+0000,Did He Like My Smile or My Race?,"We met on Bumble just before winter break. After a six-hour-long first date, the Harvard boy seemed promising. Frequent texts, plans for dates, a spontaneous trip to his hometown to see him. We both felt like we were understood. Months later, when meeting again in person, he said, “I’m not romantically attracted to you anymore.” I nodded. It happens. Sad but acceptable. Then he said, “By the way, I don’t have an Asian fetish.” Which made me wonder: Did he like the smile on my face or was he fixated on race? — Connie Chung, Boston University","Connie Chung, Boston University"
429,2019-05-14T19:00:01+0000,It’s All About the Perfect Post,"Graduation is a weird thing, not that I have gotten quite there yet. The Canadian snow has almost melted, exam season is upon us and we all have our responses ready for the inevitable question: “So, what are your plans after graduation?” I’ve met hundreds, maybe thousands of people during my time here, but only a few close friends, dear to my heart, who will go to great lengths to guarantee I get the perfect graduation ball photo to post for all my Facebook followers. — Alexandra Yiannoutsos, McGill University","Alexandra Yiannoutsos, McGill University"
430,2019-05-14T19:00:01+0000,A Rap for Rebecca,"Was surrounded by my pals, but my mind was on a gal. Her car pulled up and that was it — should’ve put cuffs around my wrists. My heart beat red then flashed blue (felt sad that the party was through). Only time she had my spirits low wasn’t her fault; she simply had to go. I wanted her to come back, kept messaging like a maniac. Four years later, she’s still here, slapping at my hand that nervously tugs at my ear. Grabbing my waist during concerts as if she protects me from monsters. — Joshua Corona, California State University of Northridge","Joshua Corona, California State University of Northridge"
431,2019-05-14T19:00:01+0000,Love in 5 to 7 Business Days,"After our first date, he said, “My people will get back to your people for some feedback assessment, and in 5 to 7 business days, I’ll get back to you.” He made me laugh, and I was determined to make him feel just as sunny. Within a few hours, I created and sent a Google form to him (in his favorite color) with questions like, “Did Madison make good eye contact?” “Was the conversation intellectually and/or emotionally stimulating?” “Was she pleasing to the eye?” He filled it out and sent it to me. Had I been stimulating? “Hell yes!” — Madison Catrett, Duke University","Madison Catrett, Duke University"
432,2019-05-14T19:00:01+0000,“Demoted from Muse to Memory”,"I’ve always wanted to find another girl who had love songs written about her, mostly so I could ask what she did with them after the relationship was over. How did she reconcile being demoted from muse to memory? My ex-boyfriend released his favorite song, about the strength of our love, on Spotify four days before he broke up with me. The song kept being recommended. I forced myself to listen. At first, I felt numb, the song sounding empty. Then it sounded like a sepia-tone photograph, dripping with nostalgia. Now over him, I don’t hear anything anymore. — Julia James, University of Mississippi","Julia James, University of Mississippi"
433,2019-05-14T19:00:01+0000,The Real Celestial Event,"The image through the telescope seems tiny, almost inconsequential. I tell this to my boyfriend, who scoffs, “Speak for yourself.” Colin is the kind of person who keeps track of eclipses — it was he who introduced me to the observatory across from where he had worked. Colin is always telling me that the next eclipse won’t appear for another century, yet endless celestial events continue to arise. Sometimes the moments around these are more memorable than the events themselves. I love a natural orange, but the blood moon only felt special when framed by the sunroof of his car. — Jeremy Wolin, Brown/Rhode Island School of Design","Jeremy Wolin, Brown/Rhode Island School of Design"
434,2019-05-14T19:00:01+0000,"No, We Totally Didn’t Meet on Tinder","Neither of us wanted to tell our parents we met on Tinder, so we spent spring break texting about alternatives. Did we sit together in a crowded dining hall? Too obvious. Blind date that a mutual friend set up? Too improbable. He caught me falling while ice skating? Too cheesy. Maybe I stopped him on his way to fencing practice to ask about his sword? I’m too shy. He joked that we were rewriting the Train song, “50 Ways to Say Goodbye,” except instead of the ways I left, we would end up with the 50 ways we’d met. — Kelly McKewin, Miami University","Kelly McKewin, Miami University"
435,2019-05-07T19:00:01+0000,"For Once, I Wanted Less","Through much of college I avoided romance because I wanted more: more knowledge, more goals, always striving. Then I fell for a close friend. The first morning I woke up to him — gentle arms, even breathing in the gray dawn — was the first time I wanted less. Less work. Less time committed to calendars. Nothing more than this small, simple present lasting. — Liana Wang, Yale University","Liana Wang, Yale University"
436,2019-05-07T19:00:01+0000,One Obvious Pro,"I grew up in a small town where same-sex relationships were considered abnormal and wrong. As I struggled with my sexuality, I began wondering, “Should I even try to have a romantic relationship?” When I left for college and fell for a girl, I was afraid to act on my feelings. My friend, John, came to my dorm to help me weigh the pros and cons of pursuing her. Later, I looked over the list by myself. John had written mostly jokes, except for one word: “Love?” — Gabriella Vacarelo, University of Massachusetts Amherst","Gabriella Vacarelo, University of Massachusetts Amherst"
437,2019-05-07T19:00:01+0000,We Weren’t Dreaming,"Our lives aligned for 22 days. For different reasons, it was not meant to be. She had to leave Lebanon and return to school in the Netherlands. Soon, it will be time for me to return to school in Spain. Strangers in Beirut, we walked around, stopping for coffee, tea, beer or wine. We could barely stop talking — but, in retrospect, my favorite moments were the few silent ones. One wintry night, she lit the wrong end of a cigarette at my window. We laughed, but I kept it. I wanted a reminder, after leaving the city (our city), that we were not dreaming. — Álvaro Fernández Cruz, Universidad Carlos III de Madrid, Spain","Álvaro Fernández Cruz, Universidad Carlos III de Madrid, Spain"
438,2019-05-07T19:00:01+0000,Taylor Swift Advice From Mom,"I’ve never been in love, but I’ve learned that maybe it’s O.K. I’ve spent too much time thinking about love, trying to figure out why I haven’t found it. Navigating the world of college boys feels like assimilating into a new country, as if it’s my first year again, my visa freshly stamped. Thankfully, an email from across time zones reminds me of the love I already hold. “RE: Advice?” my mother writes. “When you’re ready, you’ll know it … so never sell yourself short … And then it’s really wonderful and heartbreaking and all the things Taylor Swift writes songs about.” — Hadley Menk, University of St. Andrews, Scotland","Hadley Menk, University of St. Andrews, Scotland"
439,2019-05-07T19:00:01+0000,Fight or Flight,"I don’t think I understood the “fight-or-flight response” properly until I experienced it. My body would freeze when I kissed someone, alarm bells blaring in my head. My heartbeat would fill my ears and zap my brain. But one day I met someone who held me while I cried, who wanted to help, wanted to listen. He showed me that touch could be about sharing instead of taking. Touch could be about loving. Even though we knew it wasn’t meant to last, I am still grateful for the time we spent together. — Julie Vaughn, Massachusetts Institute of Technology","Julie Vaughn, Massachusetts Institute of Technology"
440,2019-05-07T19:00:01+0000,Two Astronomy Nerds,"It was supermoon night, the kind astronomy nerds long for. I had an exam the next day and my nose in a biology textbook when this strawberry blonde girl asked if anyone knew how to get to the observatory. It’s a through-the-woods kind of thing, but I did, in fact, know how to get there. We hiked with phone flashlights along two trails to the top of the hill. Looking at our moonlit shadows, we sat silent. Heading back, we got lost, and I traded a leaf for her number. — Ethan Bradley, Kenyon College","Ethan Bradley, Kenyon College"
441,2019-05-07T19:00:01+0000,"“Back Then, I Was a Straight Girl”","Remember how we met, as semi-random roommates? Back then, I was a straight girl. You were a Christian with a boyfriend. You held me during my late-night panic attacks. I annoyed you into going to class. Remember how we dated for a month? Sometimes I forget that we’re technically exes. And then the crisis: Too many friends died. Too much anti-queer turmoil on campus. I came out as a guy. You said you would only date women. We supported each other and survived. You’re my platonic soulmate. Now we have an apartment and two cats. — Elliot Eason, Georgia Institute of Technology","Elliot Eason, Georgia Institute of Technology"
442,2019-05-07T19:00:01+0000,Everybody Loves Via,"I met Julia in my fraternity’s basement after a wedding-themed party. We spent 10 weeks pretending we weren’t in love, steeling ourselves for a 6-month study-abroad separation. Reunited, we went out for awkward catch-up drinks and dinner. The night melted into a surprising familiarity. Outside her place, my Via ride-share car on the way, she said, “I love Via.” Mishearing, I blurted, “I love you, too.” She said, “It has the best algorithms!” I froze. Two years later, she kissed me and said, “I love you.” I smiled and said, “I love Via, too.” — Danny Gridley, Dartmouth College","Danny Gridley, Dartmouth College"
443,2019-04-30T19:00:01+0000,No Joke,"We are both named Phoebe. This means our path to love has been littered with disbelief, laughter and confusion. It was hard enough coming out in a lesbian relationship in our late 20s, but a relationship between two people with the same name? People say, “You’re joking, right?” But it’s no joke that when we moved the fridge during our kitchen renovation, she saw my rainbow writing on the wall, asking her to marry me. And it’s no joke that she said yes. And I’m not joking when I say that my life is very nearly perfect now. — Phoebe Wallner",Phoebe Wallner
444,2019-04-30T19:00:01+0000,"Hello, Ruby","Unspeakable pain in my right shoulder sent me to the doctor at 37 weeks pregnant. “HELLP syndrome,” she said. Life-threatening. Emergency C-section. Blood transfusions. Liver blood clot. Rare. I wasn’t ready to meet my baby girl. I searched for clues in the nurse’s eyes, asking her, “Am I going to die? Will I be able to be her mother?” My baby lived. I almost didn’t. Weeks followed where I couldn’t hold Ruby. I was too weak. Wasn’t ready. Didn’t want to. Then one day that tiny girl gave me a half smile. I knew we were going to be O.K. — Stefanie Torres",Stefanie Torres
445,2019-04-30T19:00:01+0000,My Husband Is Not My Son,"Ever since I turned 45, my husband, who is nine months younger than I am, has been repeatedly mistaken for my son. I have two 20-something sons, but Mike is not one of them. I can’t say that I’ve taken it well — or accepted it without a struggle. Botox has softened my lines, though my outlook has softened, too. Now, at 56, I see my husband's thick hair, slim physique and smooth skin as a bonus of being his partner. It makes me feel desirable. Thirty-two years ago, we chose each other. We choose each other still. — Jane Marion",Jane Marion
446,2019-04-30T19:00:01+0000,Breaking Up In a Small Town,"Breaking up in a small mountain town is hard. I still crane my neck after every white truck, searching the bed for your scratched black toolbox and the ghosts of us intertwined there, sleeping under younger stars. One day we may have children, but not together. And those children — mine, yours, but not ours — may grow up in the valley where we fell in love. They may even ski after school together. I’ll smile at your new truck across the ski hill parking lot. Your long auburn hair will be shorter and grayer, but you’ll still wear a mustache, and you’ll smile back. — Michelle DeLong",Michelle DeLong
447,2019-04-30T19:00:01+0000,We Ate Nothing But Onions,"Recently, I stood over the stove caramelizing onions. The smell suddenly reminded me of that summer we spent cooped up in our tiny dark apartment. Hiding from the heat in the day and caramelizing onions in the evening. Excited by the aroma, our feet stuck to linoleum, we came alive as the sun went down, our bellies growling for a taste. I had forgotten it was all we ate — for weeks, caramelized onions — because it was all we could afford. My memories of that time are sweet, sticky and content. Almost buried by layers of time. — Megan Bolaños",Megan Bolaños
448,2019-04-23T19:00:04+0000,Salami in the Closet,"When we met, he was studying psychology. On our first date, we split a mushroom flatbread — my choice, because I’m a vegetarian. After three months, we moved in together and he started doing all the cooking. A few years and many vegetables later, he began curing his own meats. In a New York City apartment, this meant salami hanging next to my winter coat. He started interning at a butcher shop and soon left psychology behind. I’m a vegetarian marrying a butcher this summer. That’s our idea of true love. — Shannon Cleary",Shannon Cleary
449,2019-04-23T19:00:04+0000,Twirling Until I Am Dizzy and Happy,"At the Starbucks on Wilshire Boulevard, one glance is all it took for us to decide to forgo the requisite coffee and instead walk half a mile to LACMA. It was there, in a curved chamber within the massive Richard Serra “Band” (a 13-foot-tall undulating ribbon of steel) that I — at age 63 — suddenly had the impulse to twirl. He had the impulse to set his camera on video. Almost a decade later, we watch and laugh as I spin and then stagger toward him, dizzy and happy. — Barbara Buckles",Barbara Buckles
450,2019-04-23T19:00:04+0000,The Tiniest Gas Station Man,"Adopting after 18 years of marriage is no Gap ad. Seeing my neighbors head out to dinner gives me a juvenile left-out feeling. As I head down the hallway to grab my book, I hear a babbling sound coming from my son’s room. Opening the door, I am greeted by a tiny, uncorrupted smile. I pick him up. He slides his little starfish hand down the back of my shirt for security, and there it rests, warm and powerfully attached, as if he is the gas station man filling me up with love. — Vicky Bates",Vicky Bates
451,2019-04-23T19:00:04+0000,Glad I Wore My Pink Tennis Shoes,"When we met in music theory class, he said he liked my pink tennis shoes. “Thanks,” I said. “I wear them so people think I’m athletic!” Shortly after, his roommate died in an accident on the Oregon coast. The year before, I had lost my boyfriend in a car crash. I knew what to do. I brought chili and cornbread. I listened. We became friends, roommates, best friends and then, for me, more. “I’m going to cut to the chase,” I said. “We can’t live together. I have a huge crush on you.” He smiled. It’s been 2.5 years of joy. — Chloe Smithson",Chloe Smithson
