,Published Date,Story Name,Story,Author
0,2021-05-04T19:00:07+0000,Still Cooking Side by Side,"I fry cutlets for chicken parmigiana, doing math: In my 53 years, I have fried thousands. My mother taught me. When I was 7, we would fry chicken side by side, her hip touching mine. “Cover yourself,” she would say. “You’ll get hurt and dirty that shirt.” As a teenager, I’d snap, “Ma, I hate when you use ‘dirty’ as a verb.” But, no matter the age, I would listen and grab an apron. More math: It’s been over two decades without her. But still, like magic, she reminds me to separate the cutlets and back away from the flame. — Kathy Curto",Kathy Curto
1,2021-05-04T19:00:07+0000,"A Silent, Shared Language","My abuela raised me, her first grandson, in Santiago in the 1970s, while my parents worked to support us. Then, when I was 6, we moved to Melbourne. I missed my abuela. When I was 15, she visited us in our new country, where she didn’t speak the language but still bargained at the market. At 24 and beginning law school, I returned to Santiago. My abuela cooked me lunch every day. A practicing lawyer at 40, I returned in time to say goodbye at her bedside. My family doesn’t say “I love you,” yet by my being there, I think she knew. — Miguel Belmar Salas",Miguel Belmar Salas
2,2021-05-04T19:00:07+0000,Miraculous in the Mundane,"My husband and I were 30 with three children under the age of 6 when we adopted a 16-year-old from foster care. Days were spent trying to be cool and strict and look like we knew what we were doing. Sleepless nights were spent recounting the day’s failures. But every morning we got up and did it again. Made mistakes. Laughed. Cried. Argued. Apologized. Prayed. Reminded Brandan to wear his retainer. Cheered for him at football games. Cut his hair in the garage. And, somewhere in the mundane, I became Brandan’s mother. And Brandan became my son. — Denise Kendrick",Denise Kendrick
3,2021-05-04T19:00:07+0000,Treasure Hunt,"In my 40s, I spent summers with my widowed mother in England. Before returning to New York, I would write playful notes and hide them around her house. Under the silver candlestick, she discovered: “The butcher, the baker and the candlestick maker — and your daughter — love you.” For weeks after I left, she would call and laugh. “I found another one of your little notes!” Cleaning out her house after she died, I found a box in her bedroom. Inside was every note I’d given her, organized by year — a gift she gave back to me. — Jennifer Fell Hayes",Jennifer Fell Hayes
4,2021-04-27T19:19:54+0000,Tito’s Trust,"Tito asked me to marry him, but not for the happily ever after. He had AIDS — a death sentence in the early 1980s. He wanted his property to go to his partner, Michael, but his father disapproved. After Tito’s death, I was to wait a few years, then sign everything over to Michael. I was honored by Tito’s trust and might have said yes, but his father relented, allowing Michael to inherit Tito’s assets, though he would not be invited to the funeral. Forty years later, I miss my friend. Would he be married to Michael if he were alive? — Lynn Tamayo",Lynn Tamayo
5,2021-04-27T19:19:54+0000,Maybe More Than Slightly,"“Why can’t you find someone?” my parents asked when I was 26. “He’s not here yet,” I said. “He’s in Africa.” (I’ve always been slightly psychic; my parents have always been slightly skeptical.) As the “Dating Diva” at Manhattan’s Learning Annex, I felt confident in my ability to help myself and others “find a mate or just a date.” In my 40s, I still felt confident but relied less on my “dating tricks.” One rainy night, I bumped into a tall man who rolled his R’s. Today, my South African husband says he loves me and our daughter in Afrikaans. — Estelle Erasmus",Estelle Erasmus
6,2021-04-27T19:19:54+0000,What Might Have Been,"We started dating a few months before the pandemic. She lived in New Jersey while I lived in New York, and she drove a dusty compact car. The back seat was like an Army surplus store: blankets, picnic chairs, snacks, water. She was a civil engineer and liked to be prepared. The first time we kissed was in her car, contorted across the front seats. I remember the scent of her shampoo, and the weight of everything behind us and the year ahead. The last message I received from her was: “The pressure is too high, I can’t. I’m sorry.” — Rahul D’Silva",Rahul D’Silva
7,2021-04-20T19:03:49+0000,What I Want to Remember,"I started cleaning our apartment so I could take photos to remember it by. My husband was retiring, and we were moving from New York — leaving the place where two lonesome apartments combined into this one; where two single people combined as a pair; where I, at 63, had lived longest. What I really wanted was to remember our home in all its chaotic glory: open sardine tins, piles of papers and books. So I stopped tidying. You’d think this mess was caused by moving, but really it was created because we were living. — Jill Lipton",Jill Lipton
8,2021-04-20T19:03:49+0000,Blooming Still,"Unlike the other trees Nanima planted at our home in Pakistan, I dislike this mango tree. Mango trees mean mango bugs. Three years ago, one of the mango tree’s branches touched my bedroom balcony, allowing bugs to infest my space. “Those bugs, they petrify me!” I said. (Although an adult, I was a baby in front of Nanima.) The next morning, she cut her beloved tree’s branch. Only a grandmother can love like that. This is my first spring without her. The tree will blossom, the bugs will come, but I won’t have Nanima to hear and appease my fears. — Rasti Iqbal Jamil",Rasti Iqbal Jamil
9,2021-04-20T19:03:49+0000,My Only Lasting Satisfaction,"After four years of texting, we were finally going to meet. My father had died. On my way to my family in Venezuela, I stopped in Colombia, where my online lover lived. He had me at my most vulnerable. For three days, we loved intensely, making promises about marriage, dreaming of canary-yellow diamond rings. I left for work. Our dreams sustained me. Then we broke, and I broke too. My only satisfaction is the Pablo Neruda poem I left in his room. It reads: “Cuantas veces, amor, te soñé sin verte?” How many times, love, did I dream of you without seeing you? — Sebastian Cabrices",Sebastian Cabrices
10,2021-04-20T19:03:49+0000,In an Envelope,"In 2017, my friend since 1979 had spinal surgery. I stole time from my vigil to purchase a hospital coffee. Distracted, I left my purse behind, and it was stolen. Security insisted my wallet — with driver’s license, personal information and family pictures — would turn up. It did not. Weeks later, an envelope arrived at my former office at the University of Wyoming. Return address? None. Just: “Found Scattered on Street.” Contents: faculty ID, library card, a nearly empty gum packet, one stranger’s kindness and the warmth I feel for someone I have never met. — Pamela Galbreath",Pamela Galbreath
11,2021-04-13T19:00:06+0000,Waving From the Other Side,"On my father’s workdays, he would wait for me to wake. I would dress quickly, splashing water on my face. Leaving his scooter behind so we could talk along the way, he would speak of life, of love, both of us laughing; sometimes I would cry. “You’ll understand someday,” he would say when I searched his eyes for answers. A hug, then he would cross the busy street in Mombasa, Kenya. A smile in his eyes, he would stand on the other side and wave. I cherish this memory now that he has crossed over to life’s other side. — Derrick Ochieng",Derrick Ochieng
12,2021-04-13T19:00:06+0000,A Common Mark,"There are two countries with an “X” in their English names. John is a Luxembourger; I am Mexican. Born in countries with different cultures and climates, we have two distinct ways of seeing our world. Yet older love is special because life has already shown you who you are and how others have been shaped in ways you can’t always understand. I try to impress John with my high-school French. He tries to remember his high-school Spanish. We met after marriages, children and lives far from each other. But now we have marked each other’s hearts with an “X.” — Alejandra Garza",Alejandra Garza
13,2021-04-13T19:00:06+0000,Let’s Just Breathe,"Last month, the emergency room doctor sat on the edge of my bed and said, “I have three children. Do you know how many times I’ve been pregnant?” I shook my head. “Nine.” As she left, she added, “You will have a boy and a girl. I’ve been right about my last seven friends!” The tears came and I gasped for air. Ten months of trying had ended in unthinkable loss. My husband gently cupped my face and said, “All we have to do right now is breathe. Isn’t that a wonderful thing?” And with our foreheads together, we did just that. — Beth Kuhn Metzler",Beth Kuhn Metzler
14,2021-04-13T19:00:06+0000,‘Aren’t I So Lucky?’,"My family of four lives in San Francisco. In February, we had one of our first outings for pleasure since the pandemic began. At a stationery shop on Union Street, I was looking at greeting cards when Xavier, my 6-year-old, spontaneously declared, “I love you, Mommy.” The two store clerks at the counter paused what they were doing, then smiled as if embarrassed to be caught witnessing an intimate expression. To break the ice, I asked them, “Aren’t I so lucky?” Officially invited into our moment, they gladly agreed. — Debbie Dang",Debbie Dang
15,2021-04-06T19:00:08+0000,"Looking for Someone, Maybe You","My boss at the Design Industries Foundation Fighting AIDS wanted me to meet Susan. He said that she, a hardworking designer, needed to get out more. Imagining that meant “couldn’t get a date,” I felt more resigned than happy. “How will I know you?” she asked over the phone. “I’ll be the 5-foot-9 woman who looks like I’m looking for someone.” She replied, “I’ll be the 6-footer looking for you.” Susan entered the Noho Star, now permanently closed, in a cloud of colorful fabric. I was agog, thinking, “I’m not introducing her to anyone.” I’m still agog. — Rosemary Kuropat",Rosemary Kuropat
16,2021-04-06T19:00:08+0000,When Snow Melts,"Wonder Woman’s eyes on my ninth grade journal elicit sharp memories. I purchased the notebook when I was 14, a new student in a new state. Hounded by an internal villain wielding a whip of self-doubt, I tried to emulate Wonder Woman’s strength. The pages describe a young dancer fearful of being “an ugly, stumbling little snowflake who you could miss in a blink.” Now, at 18, I look at the trees unfurling after a long New Hampshire winter. Though I have learned to appreciate snow, I am always grateful when it melts. And this is a story about spring. — Victoria Chen",Victoria Chen
17,2021-04-06T19:00:08+0000,"Oh Dearling, My Nar-Dar, Est-Est-Est!","Our terms of endearment have always evolved. Once, after a movie, “dear” and “darling” morphed into “dearling.” During lockdown in Prague, the evolution accelerated: “Darling” became “Dar-Dar,” then “Dar,” followed by “Nar-Dar” and “Nar,” and finally “Nar-Nar.” Meanwhile, “Dearling” transformed into “Dearlingest,” then “Est,” then “Est-est-est.” It makes sense: Working from home for a year and stuck in a second lockdown as the Czech Republic battles one of the world’s highest Covid death rates, we’ve had far more time together than usual. I just wonder: In what other ways has humanity evolved faster than usual this year? — Melody Rose McClure",Melody Rose McClure
18,2021-04-06T19:00:08+0000,Blowing in the Wind,"Recently we toasted with champagne in your newly purchased East London flat. Three years earlier, I watched your red nails scratch thin hospital sheets, brought you cans of Coca-Cola and coloring books after you tried to overdose. I have never been so relieved about a friend’s failure. On the first anniversary of your attempt, we traveled to Puglia, acquiring parking tickets at an alarming rate while enjoying gorgeous seaside towns. Friendships hold uncountable sorrows and joys, like toasting your new life or eating Ikea hot dogs in the store parking lot, our masks blowing like flags from our wrists. — Xan Pedisich",Xan Pedisich
19,2021-03-30T20:00:08+0000,"Our Seder, a Year Later","“Why is this night different from all the others?” Last Passover, there were more ways than usual. My father was hospitalized with low oxygen. My mother and sister, also sick, spent the holiday clutching their phones in case he called. I was with my partner, crying over chicken broth, gripped by fear. This year, I remember the virus that passed over my own blood, sparing my father as the Israelites were spared from the final plague. I find new meaning in “Dayenu,” a Seder song of gratitude with the refrain: “It would have been enough.” My family’s health will always be enough. — Amanda Glickman",Amanda Glickman
20,2021-03-30T20:00:08+0000,Sowing a Future,"Midway through 2020, I started planting seeds in my backyard. My daughter said, “You’ve wanted to do this for years. Do you like it?” “Yes,” I said. “I love it.” At the time, I didn’t realize I was growing more than tomatoes. Overwhelmed by the pandemic, my mother’s worsening dementia and the painfully quiet demise of a decades-long relationship, I was sowing a future. My head down and hands busy, I could hope. “You seem calmer even though everything is more difficult,” my daughter said. Yes. Planting new seeds is hard. Realizing old seeds are no longer growing is harder. — Karen Amster-Young",Karen Amster-Young
21,2021-03-30T20:00:08+0000,"Hello, Old Friend","Grief was that relative I heard stories about. I knew her in the way I knew Uncle Gerald, someone I never met but learned so much about. Then my husband died, and there Grief was, shaking my hand. I offered her the guest bedroom, scrambling to make it comfortable, but not too comfortable because I didn’t want her to stay long. Instead of the guest bedroom, she marched right into my bedroom and dropped her heavy bags. Years later, she’s still with me, now an old friend, someone to sip martinis with and remember. — Barbara Phillips",Barbara Phillips
22,2021-03-30T20:00:08+0000,Teacher of the Year,"In March 2009, two weeks after my students voted me teacher of the year, I learned I wouldn’t be returning to school after summer break. State budget cuts had threatened hundreds of thousands of public schoolteacher positions around the country. I finished the semester, teaching five high school Spanish classes with a total of 110 students. When they discovered that I wouldn’t be returning, a clandestine plan was set in motion. They surprised me, arriving at school wearing custom T-shirts that read “I support Ms. Minsky.” That expression of affection helped carry me through a dark time. — Connie Minsky",Connie Minsky
23,2021-03-23T19:00:07+0000,"My Mother, My Friend","My first semester of college, I only called my mother twice. At my house, I felt generally misunderstood and judged for my weight; at school, I was finally free. But the pandemic forced me home. I spent the first months in my room. Then, my mother and I started watching Chinese competition shows together, bonding over the contestants. Now I make sure she’s eating even when she avoids meals to stay thin. We converse in simple Mandarin, a language I hadn’t bothered to learn before. I buy her flowers and cry when I think of leaving her. — Annabelle Wang",Annabelle Wang
24,2021-03-23T19:00:07+0000,‘Love Endures Without Fresh Photos’,"I take a lot of photos. My house is filled with images of places I have visited and people I love. I rotate the photos, taking new ones, making more prints, slipping new pictures over old ones in frames. But I have realized, six months after my partner’s sudden death, that the photos I have of John are all I will ever have. So I conjure up memories of him — hiking in the Sierras, enjoying a party, reading at the kitchen table. Love endures without fresh photos, but oh how I miss stealthily snapping him. — Ellen Greenblatt",Ellen Greenblatt
25,2021-03-23T19:00:07+0000,Lean on Me (When You’re in Heels),"Our pace slowed as Monica’s feet started to hurt in her blue velvet heels. I was wearing sneakers and offered to switch. I stumbled along, leaning most of my weight on her shoulders. We only made it one city block before switching back. This wasn’t the first or last time she would prop me up as I floundered uncomfortable in femininity. Later she would help me change my legal name and gender marker. She still loves — and can rock — high heels. But next time the night gets long, I will probably offer a piggyback ride. — Nat Mulkey",Nat Mulkey
26,2021-03-23T19:00:07+0000,A Man Who’s Just Right,"From the back seat, my 5-year-old son, Jack, said: “Mommy, why don’t you have a boyfriend?” Freshly divorced and unsure how to answer, I asked why he asked. Jack replied, “Because you’re really nice. You should be with someone nice.” I realized the troubles of my previous marriage had not gone unnoticed. Jack said I should look for someone kind, respectful and of medium height — like Grandma. Eight years later, Jack calls my husband, Greg, “Dad.” I tease Greg that it’s a good thing that he’s on the shorter side, just like my mother. — Clara Koschnitzke Hoffmann",Clara Koschnitzke Hoffmann
27,2021-03-16T19:00:07+0000,I Guess I Passed Her Test,"As a dutiful girlfriend, I accompanied Arturo to J.F.K. Airport to pick up his sister, who was arriving from Buenos Aires. Greeting her, I casually asked what brought her to New York. “Mami sent me to check you out,” she said. Years later, Mami was visiting us. She offered to buy me a replacement diamond for the one that fell out of my engagement ring. “Oh, I can’t allow you to buy me something so expensive,” I said. Her reply? “Please do, because you are everything I hoped for in a wife for my son.” How could I refuse? — Phyllis Meyers",Phyllis Meyers
28,2021-03-16T19:00:07+0000,She’s Still With Us,"In February 2019, my youngest sister, Melina, admitted herself into the hospital for PTSD from childhood trauma. When she returned home, she texted, “Do not contact me ever again!” Determined to get through to her, I invited her to walk with me and Preston, my goldendoodle. She loved Preston but refused. In March, Melina died of suicide. On a walk the morning after her funeral, Preston suddenly turned and barked behind us. Nothing was in sight. I felt then that Melina had changed her mind and decided, after all, to join us. — Sarina Tomel",Sarina Tomel
29,2021-03-16T19:00:07+0000,No Words Needed,"I spoke to Sun Ung in broken Chinese, excited hand gestures and hugs. We lived together for 18 years: a strong-willed Cambodian refugee and me, his spunky Texan granddaughter. Then his Alzheimer’s took hold. He would scrunch his eyebrows, searching for our history in a sea of fading memories. I started every sentence with, “Remember when — ?” But, one of our final nights together before he died last March, we sat beside each other in silence. A granddaughter without the words to convey her love. A grandfather who didn’t need to remember the past to know she loved him anyway. — Sabrina Wong",Sabrina Wong
30,2021-03-16T19:00:07+0000,An Unexpected Request,"Chantal and I met in Bordeaux, France. I was an American student, with long hair and a beard, dressed like John Lennon in olive Army surplus fatigues. Chantal, whose grandfather escaped Mussolini, looked like Isabella Rossellini. We married in Oakland, Calif. Chantal did not want children; I did. We divorced. Chantal’s journey continued, wild as ever. Mine: law school, suburbs, remarriage, children and Little League. Chantal would sometimes call. She became a psychologist. Once, Chantal said she wanted a child and asked if I’d be the father. I mistakenly told my wife. Flattered, remembering, hesitating, I said no. Nice though. — Mark Rice",Mark Rice
31,2021-03-09T20:30:07+0000,Turning Bitter Fruit Sweet,"A blue dawn as I think about how life will proceed without 80-year-old me. How to make those dim vapors disperse? Eggs, coffee, a thin slice of toast and — dare I open a jar of my homemade marmalade? With the inordinate work to make the jam — slicing countless sour oranges into small pieces — I’ve always saved these jars to give to special people. But today, in a wild, life-affirming gesture, I open the preserves for myself. Sticky and runny, the marmalade acts as an elixir, melting away the trailing wisps of blue. — Marilyn Slutzky Zucker",Marilyn Slutzky Zucker
32,2021-03-09T20:30:07+0000,Music From Myanmar,"I was teaching English in Myanmar when we met, two years ago. Music connected us — afternoons strumming a cheap guitar as we tried to harmonize. I was learning Burmese. He covered our apartment in Post-it notes with each item’s Burmese name. This January, I returned home to Australia because my mother was sick. In February, when the military staged a coup in Myanmar, he said, “They stole our future.” I could feel his frustration and pain. But every night when we FaceTime, he smiles and joins his neighbors as they bang kitchenware in protest. A hopeful harmony. — Audric Co",Audric Co
33,2021-03-09T20:30:07+0000,Crazy Drives,"For three days, Chris commuted six hours round trip from Virginia to his work in Pennsylvania so he could hold me as I mourned my father. Over the years, my father had done crazy drives for me, his steadfast help showing an unconditional love. Moving me from Virginia to Chicago, we talked so much we missed our exits. I thought the only people who would continue to love me that deeply were my mother and brother. But Chris did, and does. My father would be happy to know someone is still doing crazy drives for me. — Apurva Sisodia",Apurva Sisodia
34,2021-03-09T20:30:07+0000,A Stranger on the Subway,"The subway roared into 14th Street. His hand was tucked in my pocket; mine held yellow tulips. It was a brisk March evening, but the tulips were sunny, his hand warm, and I felt like spring. Wrapped in the comfort of a full belly and heart, squished into subway seats, I talked to him about things I can’t remember now. “I had to take a picture,” a woman across the train said, waving her phone. “The way you’re looking at each other — I have chills.” I miss that woman, the people she photographed and the steadiness of those springtime flowers. — Kaitlyn Powers",Kaitlyn Powers
35,2021-03-02T20:00:07+0000,The Last Word,"My first message to you, 44 years after high school: “I remember you; you had that long, pretty hair.” You told me about the car accident that left your lower body paralyzed. I told you that our wholeness doesn’t depend on the body. You wrote to me about making art, cooking, living in Mexico, your love for your son, your joyful creativity after surgery. In December, you stopped messaging. I was heartbroken to learn that you died. Then I reread your last message, about how we are connected in unseen and mystical ways. What a gift, intimacy with you. — Alice Hogan",Alice Hogan
36,2021-03-02T20:00:07+0000,Our Big Reality Check,"After my 13-year marriage fell apart, I rented an apartment a few blocks from our family home in Rome. Three days later, Italy went into lockdown. I began a new life, along with the rest of the nation, working remotely and spending time with my children. My split was suddenly the second most important thing happening. As my wife and I grappled with the pandemic, pain and regret fell to the side. Is it possible that lockdown is our friend? It may seem cruel, but we are not ready for real life. — Federico Petrangeli",Federico Petrangeli
37,2021-03-02T20:00:07+0000,‘Gram Loves You. Please Call.’,"My grandmother Ruth was like a secret agent. Before cellphones or the internet, she would covertly track her grandchildren. At 23, I moved to Mexico to work for a resort. I was, at last, on my own. One night, while I was drinking with my co-workers at a beach bar, a man from a nearby village walked in and shouted my full name. When I responded, he marched up to me and said, “Your abuela has called each house in our village. I was chosen to find you with this message: ‘Gram loves you. Please call.’” — Amy Gotliffe",Amy Gotliffe
38,2021-03-02T20:00:07+0000,Green Ginger Wine,"“It’s time, it’s time, for green ginger wine,” we would chant every Friday night as we danced around the kitchen, my lover’s hand at my waist, my arm around his wife. We drank wine from goblets as their toddler yelled happily at our feet. It would be a long time before I admitted to myself that sex with him no longer felt right, that I was more in love with our life together than I was with my lover. When I broke up with him, I stayed friends with his wife, and wondered if their child would remember me. — Melanie Pryor",Melanie Pryor
39,2021-02-23T20:00:07+0000,Negotiating Separation,"Outside the Chicago airport the cold creeps up my coat, stiffening my spine as I hug my husband. We haven’t been apart for over a year. I board the plane alone because Nick isn’t vaccinated. At immigration in Harare, I remove my wedding ring and check the “single” box. Love between two men is illegal in Zimbabwe. I adapt to survive. When I emerge, the balmy air relaxes my spine as I hug my mother, Bharati. We cry, mourning the togetherness we’ve lost this year. I also cry for my husband, who drove home alone. One reunion requiring another separation. — Khameer Kidia",Khameer Kidia
